class,gene_id,Function description by WTD,gene_name,Description,fc,log2(fc),pval,qval,regulation,significant,GO,KEGG,KO_ENTRY,EntrezID,transcript_id,EC,trans_type,FPKM.HP6_1,FPKM.HP6_2,FPKM.Hp6_3,FPKM.HP6_5,FPKM.HP6_6,FPKM.HP0_1,FPKM.HP0_2,FPKM.HP0_4,FPKM.HP0_5,FPKM.HP0_6
,,,,,,,,,,,,,,,,,,,,,,,,,,,
,,,,,,,,,,,,,,,,,,,,,,,,,,,
Hypoxia-related responses (mitophagy/autophagy/stresses),ENSBTAG00000053296,"Catalyzes the post-translational formation of 4-hydroxyproline in hypoxia-inducible factor (HIF) alpha proteins. This protein functions as a cellular oxygen sensor, and under normal oxygen concentration, modification by prolyl hydroxylation is a key regulatory event that targets HIF subunits for proteasomal destruction via the von Hippel-Lindau ubiquitylation complex",EGLN1,egl-9 family hypoxia inducible factor 1 ,2.51,1.33,0.00,0.00,up,yes,"GO:0001666(response to hypoxia);GO:0005506(iron ion binding);GO:0005737(cytoplasm);GO:0005829(cytosol);GO:0006879(cellular iron ion homeostasis);GO:0008198(ferrous iron binding);GO:0014069(postsynaptic density);GO:0016491(oxidoreductase activity);GO:0016705(oxidoreductase activity, acting on paired donors, with incorporation or reduction of molecular oxygen);GO:0016706(2-oxoglutarate-dependent dioxygenase activity);GO:0018401(peptidyl-proline hydroxylation to 4-hydroxy-L-proline);GO:0031418(L-ascorbic acid binding);GO:0031545(peptidyl-proline 4-dioxygenase activity);GO:0032364(oxygen homeostasis);GO:0043433(negative regulation of DNA-binding transcription factor activity);GO:0045765(regulation of angiogenesis);GO:0045944(positive regulation of transcription by RNA polymerase II);GO:0055008(cardiac muscle tissue morphogenesis);GO:0055114(oxidation-reduction process);GO:0060347(heart trabecula formation);GO:0060412(ventricular septum morphogenesis);GO:0060711(labyrinthine layer development);GO:0071731(response to nitric oxide);GO:0098978(glutamatergic synapse);GO:0099175(regulation of postsynapse organization);GO:0099576(regulation of protein catabolic process at postsynapse, modulating synaptic transmission);GO:1901214(regulation of neuron death)",04066(HIF-1 signaling pathway);05200(Pathways in cancer);05211(Renal cell carcinoma),K09592,534075,ENSBTAT00000066920,EC:1.14.11.29,protein_coding,29.21,28.51,29.31,29.78,31.03,12.97,11.38,12.22,11.53,10.91
Hypoxia-related responses (mitophagy/autophagy/stresses),ENSBTAG00000008172,Peptidyl-proline hydroxylation to 4-hydroxy-L-proline; and response to hypoxia.,EGLN3,egl-9 family hypoxia inducible factor 3 ,4.75,2.25,0,0,up,yes,"GO:0001666(response to hypoxia);GO:0005506(iron ion binding);GO:0005634(nucleus);GO:0005737(cytoplasm);GO:0005829(cytosol);GO:0006915(apoptotic process);GO:0006919(activation of cysteine-type endopeptidase activity involved in apoptotic process);GO:0016491(oxidoreductase activity);GO:0016705(oxidoreductase activity, acting on paired donors, with incorporation or reduction of molecular oxygen);GO:0016706(2-oxoglutarate-dependent dioxygenase activity);GO:0018126(protein hydroxylation);GO:0018401(peptidyl-proline hydroxylation to 4-hydroxy-L-proline);GO:0031418(L-ascorbic acid binding);GO:0031545(peptidyl-proline 4-dioxygenase activity);GO:0042127(regulation of cell population proliferation);GO:0046872(metal ion binding);GO:0055114(oxidation-reduction process)",04066(HIF-1 signaling pathway);05200(Pathways in cancer);05211(Renal cell carcinoma),K09592,535578,ENSBTAT00000010744,EC:1.14.11.29,protein_coding,131.17,130.70,142.22,146.84,140.16,28.33,29.16,29.89,29.51,28.61
Hypoxia-related responses (mitophagy/autophagy/stresses),ENSBTAG00000012403,HIF-2/Arg1 axis confers an anti-inflammatory response,ARG1,arginase 1 ,382.79,8.58,0.01,0.07,up,yes,"GO:0000050(urea cycle);GO:0004053(arginase activity);GO:0005615(extracellular space);GO:0005737(cytoplasm);GO:0005829(cytosol);GO:0006525(arginine metabolic process);GO:0016787(hydrolase activity);GO:0016813(hydrolase activity, acting on carbon-nitrogen (but not peptide) bonds, in linear amidines);GO:0019547(arginine catabolic process to ornithine);GO:0030145(manganese ion binding);GO:0042130(negative regulation of T cell proliferation);GO:0042832(defense response to protozoan);GO:0046007(negative regulation of activated T cell proliferation);GO:0046872(metal ion binding);GO:0060336(negative regulation of interferon-gamma-mediated signaling pathway);GO:0070965(positive regulation of neutrophil mediated killing of fungus);GO:2000552(negative regulation of T-helper 2 cell cytokine production)",00220(Arginine biosynthesis);00330(Arginine and proline metabolism);05146(Amoebiasis),K01476,"513608,64129",ENSBTAT00000016461,EC:3.5.3.1,protein_coding,0.07,0,0.12,0,0,0,0,0,0,0
Hypoxia-related responses (mitophagy/autophagy/stresses),ENSBTAG00000003741,"Ubiquitination, Ubiquitin ligase 3 mediate the transfer of ubiquitin from an E2 ubiquitin-conjugating enzyme to specific substrate proteins",NEURL1,neuralized E3 ubiquitin protein ligase 1 ,673.62,9.40,0.00,0.00,up,yes,"GO:0004842(ubiquitin-protein transferase activity);GO:0005737(cytoplasm);GO:0005886(plasma membrane);GO:0006513(protein monoubiquitination);GO:0007288(sperm axoneme assembly);GO:0007399(nervous system development);GO:0007595(lactation);GO:0008285(negative regulation of cell population proliferation);GO:0014069(postsynaptic density);GO:0016567(protein ubiquitination);GO:0030317(flagellated sperm motility);GO:0043065(positive regulation of apoptotic process);GO:0043197(dendritic spine);GO:0043204(perikaryon);GO:0045183(translation factor activity, non-nucleic acid binding);GO:0045741(positive regulation of epidermal growth factor-activated receptor activity);GO:0045746(negative regulation of Notch signaling pathway);GO:0048170(positive regulation of long-term neuronal synaptic plasticity);GO:0051491(positive regulation of filopodium assembly);GO:0060999(positive regulation of dendritic spine development);GO:0061630(ubiquitin protein ligase activity);GO:0071230(cellular response to amino acid stimulus);GO:0090129(positive regulation of synapse maturation);GO:0097440(apical dendrite)",NA,K01931,510334,ENSBTAT00000071563,EC:2.3.2.27,protein_coding,0.11,0.01,0.10,0.05,0.07,0,0,0,0,0
Hypoxia-related responses (mitophagy/autophagy/stresses),ENSBTAG00000018948,a transcriptional regulator in adaptive response to low oxygen tension,HIF3A,hypoxia inducible factor 3 subunit alpha ,3.60,1.85,0.04,0.18,up,yes,"GO:0000981(DNA-binding transcription factor activity, RNA polymerase II-specific);GO:0001666(response to hypoxia);GO:0003677(DNA binding);GO:0003700(DNA-binding transcription factor activity);GO:0005634(nucleus);GO:0005654(nucleoplasm);GO:0005829(cytosol);GO:0005886(plasma membrane);GO:0006355(regulation of transcription, DNA-templated);GO:0006357(regulation of transcription by RNA polymerase II);GO:0006366(transcription by RNA polymerase II);GO:0045944(positive regulation of transcription by RNA polymerase II);GO:0046983(protein dimerization activity);GO:0046983(protein dimerization activity)",NA,K09096,507699,ENSBTAT00000077826;ENSBTAT00000077844,NA,protein_coding,0.02,0.05,0.03,0.05,0.03,0,0.02,0.01,0,0.02
Hypoxia-related responses (mitophagy/autophagy/stresses),ENSBTAG00000016836,"Hypoxia, Glycolysis",PDK1,pyruvate dehydrogenase kinase 1 ,3.24,1.69,0.00,0.00,up,yes,GO:0004672(protein kinase activity);GO:0004740(pyruvate dehydrogenase (acetyl-transferring) kinase activity);GO:0005634(nucleus);GO:0005730(nucleolus);GO:0005739(mitochondrion);GO:0005967(mitochondrial pyruvate dehydrogenase complex);GO:0006468(protein phosphorylation);GO:0008283(cell population proliferation);GO:0008631(intrinsic apoptotic signaling pathway in response to oxidative stress);GO:0010510(regulation of acetyl-CoA biosynthetic process from pyruvate);GO:0010906(regulation of glucose metabolic process);GO:0097411(hypoxia-inducible factor-1alpha signaling pathway);GO:0097411(hypoxia-inducible factor-1alpha signaling pathway),04066(HIF-1 signaling pathway);04360(Axon guidance);05230(Central carbon metabolism in cancer);05230(Central carbon metabolism in cancer),K12077,"528655,5170",ENSBTAT00000084040;ENSBTAT00000038518,EC:2.7.11.2,protein_coding,11.76,11.73,11.27,11.99,11.89,4.02,3.35,3.24,4.33,3.18
Hypoxia-related responses (mitophagy/autophagy/stresses),ENSBTAG00000017804,Regulates mitophagy during hypoxia,BNIP3,BCL2 interacting protein 3 ,9.45,3.24,0,0,up,yes,GO:0005635(nuclear envelope);GO:0005739(mitochondrion);GO:0005740(mitochondrial envelope);GO:0005741(mitochondrial outer membrane);GO:0005783(endoplasmic reticulum);GO:0006915(apoptotic process);GO:0008626(granzyme-mediated apoptotic signaling pathway);GO:0009617(response to bacterium);GO:0010637(negative regulation of mitochondrial fusion);GO:0010821(regulation of mitochondrion organization);GO:0014069(postsynaptic density);GO:0016020(membrane);GO:0016021(integral component of membrane);GO:0016239(positive regulation of macroautophagy);GO:0031307(integral component of mitochondrial outer membrane);GO:0031966(mitochondrial membrane);GO:0035694(mitochondrial protein catabolic process);GO:0042802(identical protein binding);GO:0042803(protein homodimerization activity);GO:0043065(positive regulation of apoptotic process);GO:0043066(negative regulation of apoptotic process);GO:0043068(positive regulation of programmed cell death);GO:0043243(positive regulation of protein complex disassembly);GO:0043653(mitochondrial fragmentation involved in apoptotic process);GO:0045837(negative regulation of membrane potential);GO:0046902(regulation of mitochondrial membrane permeability);GO:0046982(protein heterodimerization activity);GO:0050873(brown fat cell differentiation);GO:0051020(GTPase binding);GO:0051607(defense response to virus);GO:0060548(negative regulation of cell death);GO:0071260(cellular response to mechanical stimulus);GO:0071279(cellular response to cobalt ion);GO:0071456(cellular response to hypoxia);GO:0072593(reactive oxygen species metabolic process);GO:0090141(positive regulation of mitochondrial fission);GO:0090200(positive regulation of release of cytochrome c from mitochondria);GO:0097193(intrinsic apoptotic signaling pathway);GO:0097345(mitochondrial outer membrane permeabilization);GO:1901998(toxin transport);GO:1903715(regulation of aerobic respiration);GO:1990144(intrinsic apoptotic signaling pathway in response to hypoxia);GO:2000378(negative regulation of reactive oxygen species metabolic process),04068(FoxO signaling pathway);04137(Mitophagy - animal);04140(Autophagy - animal);05134(Legionellosis),K15464,615342,ENSBTAT00000023684,NA,protein_coding,277.13,301.05,327.98,330.32,342.44,30.60,30.76,35.97,36.68,32.98
Hypoxia-related responses (mitophagy/autophagy/stresses),ENSBTAG00000021487,a negative regulatory component of the circadian clock in response to stress,CIART,circadian associated repressor of transcription ,14.02,3.81,0.00,0.00,up,yes,"GO:0000976(transcription regulatory region sequence-specific DNA binding);GO:0000980(RNA polymerase II distal enhancer sequence-specific DNA binding);GO:0005634(nucleus);GO:0032922(circadian regulation of gene expression);GO:0045475(locomotor rhythm);GO:0045892(negative regulation of transcription, DNA-templated);GO:0070888(E-box binding);GO:0070888(E-box binding)",NA,K21599,104968463,ENSBTAT00000028639;ENSBTAT00000076935,NA,protein_coding,1.28,1.05,1.67,0.91,1.62,0.06,0.07,0.14,0.14,0.06
Hypoxia-related responses (mitophagy/autophagy/stresses),ENSBTAG00000009849,promotes the autophagic activity via mTOR signaling,PLAC8,placenta-specific 8 ,297.24,8.22,0.02,0.11,up,yes,NA,NA,NA,29124,ENSBTAT00000012987;ENSBTAT00000084285,NA,protein_coding,0,0,0,0.05,0.10,0,0,0,0,0
Hypoxia-related responses (mitophagy/autophagy/stresses),ENSBTAG00000011970,nutrient sensing by regulating the AMPK-mTOR signaling pathway,FNIP2,folliculin interacting protein 2 ,2.08,1.05,0.00,0.00,up,yes,GO:0000122(negative regulation of transcription by RNA polymerase II);GO:0001932(regulation of protein phosphorylation);GO:0005737(cytoplasm);GO:0006468(protein phosphorylation);GO:0007005(mitochondrion organization);GO:0008630(intrinsic apoptotic signaling pathway in response to DNA damage);GO:0031334(positive regulation of protein complex assembly);GO:0033138(positive regulation of peptidyl-serine phosphorylation);GO:0038202(TORC1 signaling);GO:0042030(ATPase inhibitor activity);GO:0051087(chaperone binding);GO:0051087(chaperone binding),04150(mTOR signaling pathway);04150(mTOR signaling pathway),K20401,100138353,ENSBTAT00000070927;ENSBTAT00000015882;ENSBTAT00000085360;ENSBTAT00000067422,NA,protein_coding,3.03,3.16,3.23,3.00,3.72,1.69,1.39,1.71,1.56,1.42
Hypoxia-related responses (mitophagy/autophagy/stresses),ENSBTAG00000000163,"a negative regulator of mTOR, a serine/threonine kinase that regulates a variety of cellular functions such as growth, proliferation and autophagy",DDIT4,DNA damage inducible transcript 4 ,2.57,1.36,0,0,up,yes,GO:0001666(response to hypoxia);GO:0001764(neuron migration);GO:0005737(cytoplasm);GO:0005739(mitochondrion);GO:0005829(cytosol);GO:0006915(apoptotic process);GO:0007420(brain development);GO:0008283(cell population proliferation);GO:0009968(negative regulation of signal transduction);GO:0010801(negative regulation of peptidyl-threonine phosphorylation);GO:0030182(neuron differentiation);GO:0032007(negative regulation of TOR signaling);GO:0032984(protein-containing complex disassembly);GO:0033137(negative regulation of peptidyl-serine phosphorylation);GO:0042771(intrinsic apoptotic signaling pathway in response to DNA damage by p53 class mediator);GO:0045820(negative regulation of glycolytic process);GO:0048011(neurotrophin TRK receptor signaling pathway);GO:0051607(defense response to virus);GO:0071549(cellular response to dexamethasone stimulus);GO:0071889(14-3-3 protein binding);GO:0072593(reactive oxygen species metabolic process);GO:1901216(positive regulation of neuron death);GO:1902532(negative regulation of intracellular signal transduction),04140(Autophagy - animal);04150(mTOR signaling pathway);04151(PI3K-Akt signaling pathway);05206(MicroRNAs in cancer),K08270,529235,ENSBTAT00000000187,NA,protein_coding,179.47,194.72,192.31,195.75,193.01,73.34,77.90,73.58,73.50,73.69
Hypoxia-related responses (mitophagy/autophagy/stresses),ENSBTAG00000010610,"a negative regulator of mTOR, a serine/threonine kinase that regulates a variety of cellular functions such as growth, proliferation and autophagy",DDIT4L,DNA damage inducible transcript 4 like ,2.00,1.00,0.00,0.00,up,yes,GO:0005737(cytoplasm);GO:0009968(negative regulation of signal transduction),NA,NA,510906,ENSBTAT00000014026,NA,protein_coding,1.02,0.61,0.57,0.89,0.79,0.50,0.44,0.26,0.45,0.29
Hypoxia-related responses (mitophagy/autophagy/stresses),ENSBTAG00000039035,heat shock protein 70,HSPA6,heat shock protein family A (Hsp70) member 6 ,3.76,1.91,0.00,0.00,up,yes,"GO:0000166(nucleotide binding);GO:0005524(ATP binding);GO:0005634(nucleus);GO:0005737(cytoplasm);GO:0005814(centriole);GO:0005829(cytosol);GO:0006986(response to unfolded protein);GO:0008180(COP9 signalosome);GO:0016887(ATPase activity);GO:0019899(enzyme binding);GO:0031072(heat shock protein binding);GO:0032991(protein-containing complex);GO:0034605(cellular response to heat);GO:0034620(cellular response to unfolded protein);GO:0042026(protein refolding);GO:0042623(ATPase activity, coupled);GO:0044183(protein folding chaperone);GO:0051082(unfolded protein binding);GO:0051085(chaperone cofactor-dependent protein refolding);GO:0051787(misfolded protein binding)",NA,NA,539835,ENSBTAT00000057500,NA,protein_coding,1.07,1.11,0.84,1.20,1.09,0.25,0.41,0.26,0.22,0.28
,,,,,,,,,,,,,,,,,,,,,,,,,,,
,,,,,,,,,,,,,,,,,,,,,,,,,,,
Glucose metabolism,ENSBTAG00000009617,"Glucose transport, GLUT1",SLC2A1,solute carrier family 2 member 1 ,3.80,1.927830692,0,0,up,yes,GO:0001939(female pronucleus);GO:0005215(transporter activity);GO:0005355(glucose transmembrane transporter activity);GO:0005737(cytoplasm);GO:0005829(cytosol);GO:0005886(plasma membrane);GO:0005887(integral component of plasma membrane);GO:0008643(carbohydrate transport);GO:0016020(membrane);GO:0016021(integral component of membrane);GO:0016323(basolateral plasma membrane);GO:0016324(apical plasma membrane);GO:0022857(transmembrane transporter activity);GO:0030496(midbody);GO:0030864(cortical actin cytoskeleton);GO:0031982(vesicle);GO:0033300(dehydroascorbic acid transmembrane transporter activity);GO:0042149(cellular response to glucose starvation);GO:0042470(melanosome);GO:0042802(identical protein binding);GO:0043621(protein self-association);GO:0045121(membrane raft);GO:0046323(glucose import);GO:0055056(D-glucose transmembrane transporter activity);GO:0055085(transmembrane transport);GO:0065003(protein-containing complex assembly);GO:0070837(dehydroascorbic acid transport);GO:1904659(glucose transmembrane transport);GO:1904659(glucose transmembrane transport),04066(HIF-1 signaling pathway);04911(Insulin secretion);04919(Thyroid hormone signaling pathway);04920(Adipocytokine signaling pathway);04922(Glucagon signaling pathway);04931(Insulin resistance);04976(Bile secretion);05166(Human T-cell leukemia virus 1 infection);05200(Pathways in cancer);05211(Renal cell carcinoma);05230(Central carbon metabolism in cancer);05230(Central carbon metabolism in cancer),K07299,282356,ENSBTAT00000042960;ENSBTAT00000068903,NA,protein_coding,288.6571788,302.0919833,326.0506884,334.6035572,349.2263255,85.9324549,83.15519323,82.64246317,85.89089663,83.06301202
Glucose metabolism,ENSBTAG00000004556,"Glucose transport, GLUT3",SLC2A3,solute carrier family 2 member 3 ,24.82,4.633677832,0,0,up,yes,GO:0005215(transporter activity);GO:0005355(glucose transmembrane transporter activity);GO:0008643(carbohydrate transport);GO:0016020(membrane);GO:0016021(integral component of membrane);GO:0022857(transmembrane transporter activity);GO:0055085(transmembrane transport);GO:1904659(glucose transmembrane transport),NA,K08142,282358,ENSBTAT00000042889,NA,protein_coding,51.096714,55.116665,60.028595,59.308155,63.150681,2.313773,2.921848,2.179714,2.33714,1.877318
Glucose metabolism,ENSBTAG00000013108,Glycolysis,HK2,hexokinase 2 ,3.01,1.59,0,0,up,yes,"GO:0000166(nucleotide binding);GO:0001678(cellular glucose homeostasis);GO:0004340(glucokinase activity);GO:0004396(hexokinase activity);GO:0005524(ATP binding);GO:0005536(glucose binding);GO:0005741(mitochondrial outer membrane);GO:0005829(cytosol);GO:0005975(carbohydrate metabolic process);GO:0006006(glucose metabolic process);GO:0006096(glycolytic process);GO:0008637(apoptotic mitochondrial changes);GO:0008865(fructokinase activity);GO:0016301(kinase activity);GO:0016310(phosphorylation);GO:0016740(transferase activity);GO:0016773(phosphotransferase activity, alcohol group as acceptor);GO:0019158(mannokinase activity);GO:0035795(negative regulation of mitochondrial membrane permeability);GO:0045766(positive regulation of angiogenesis);GO:0046324(regulation of glucose import);GO:0046835(carbohydrate phosphorylation);GO:0051156(glucose 6-phosphate metabolic process);GO:0072655(establishment of protein localization to mitochondrion);GO:0072656(maintenance of protein location in mitochondrion);GO:1904925(positive regulation of autophagy of mitochondrion in response to mitochondrial depolarization);GO:1990830(cellular response to leukemia inhibitory factor);GO:2000378(negative regulation of reactive oxygen species metabolic process);GO:2000378(negative regulation of reactive oxygen species metabolic process)","00010(Glycolysis / Gluconeogenesis);00051(Fructose and mannose metabolism);00052(Galactose metabolism);00500(Starch and sucrose metabolism);00520(Amino sugar and nucleotide sugar metabolism);00524(Neomycin, kanamycin and gentamicin biosynthesis);04066(HIF-1 signaling pathway);04910(Insulin signaling pathway);04930(Type II diabetes mellitus);04973(Carbohydrate digestion and absorption);05230(Central carbon metabolism in cancer);05230(Central carbon metabolism in cancer)",K00844,"788926,29911,3741,3796",ENSBTAT00000060994;ENSBTAT00000079050,EC:2.7.1.1,protein_coding,85.73,85.68,94.22,94.47,95.75,30.90,29.55,29.84,31.97,28.93
Glucose metabolism,ENSBTAG00000008401,Glycolysis,PFKFB3,"6-phosphofructo-2-kinase/fructose-2,6-biphosphatase 3 ",8.77,3.13,0,0,up,yes,"GO:0003824(catalytic activity);GO:0003873(6-phosphofructo-2-kinase activity);GO:0004331(fructose-2,6-bisphosphate 2-phosphatase activity);GO:0005524(ATP binding);GO:0005829(cytosol);GO:0006000(fructose metabolic process);GO:0006003(fructose 2,6-bisphosphate metabolic process);GO:0016301(kinase activity);GO:0016310(phosphorylation);GO:0016311(dephosphorylation);GO:0046835(carbohydrate phosphorylation);GO:0046835(carbohydrate phosphorylation)",00051(Fructose and mannose metabolism);04066(HIF-1 signaling pathway);04152(AMPK signaling pathway);04152(AMPK signaling pathway),K01103,407183,ENSBTAT00000078427;ENSBTAT00000057357;ENSBTAT00000082281;ENSBTAT00000074484;ENSBTAT00000077870;ENSBTAT00000067683,3.1.3.46;EC:2.7.1.105,protein_coding,11.96,13.27,13.64,14.33,15.31,1.41,1.63,1.85,1.36,1.57
Glucose metabolism,ENSBTAG00000017461,"Glycolysis, lactate transport, ",SLC16A3,solute carrier family 16 member 3 ,4.95,2.308833596,2.1729E-225,2.3156E-222,up,yes,GO:0005886(plasma membrane);GO:0005887(integral component of plasma membrane);GO:0008028(monocarboxylic acid transmembrane transporter activity);GO:0015129(lactate transmembrane transporter activity);GO:0015718(monocarboxylic acid transport);GO:0016020(membrane);GO:0016021(integral component of membrane);GO:0031965(nuclear membrane);GO:0035873(lactate transmembrane transport);GO:0055085(transmembrane transport);GO:0055085(transmembrane transport),05230(Central carbon metabolism in cancer);05230(Central carbon metabolism in cancer),K08180,510085,ENSBTAT00000023209;ENSBTAT00000066453,NA,protein_coding,28.90508016,33.43219505,35.79905217,34.40618779,36.62424412,6.869963211,5.817419327,7.505964922,7.383127986,6.565359801
Glucose metabolism,ENSBTAG00000016836,"Hypoxia, Glycolysis",PDK1,pyruvate dehydrogenase kinase 1 ,3.24,1.69,0.00,0.00,up,yes,GO:0004672(protein kinase activity);GO:0004740(pyruvate dehydrogenase (acetyl-transferring) kinase activity);GO:0005634(nucleus);GO:0005730(nucleolus);GO:0005739(mitochondrion);GO:0005967(mitochondrial pyruvate dehydrogenase complex);GO:0006468(protein phosphorylation);GO:0008283(cell population proliferation);GO:0008631(intrinsic apoptotic signaling pathway in response to oxidative stress);GO:0010510(regulation of acetyl-CoA biosynthetic process from pyruvate);GO:0010906(regulation of glucose metabolic process);GO:0097411(hypoxia-inducible factor-1alpha signaling pathway);GO:0097411(hypoxia-inducible factor-1alpha signaling pathway),04066(HIF-1 signaling pathway);04360(Axon guidance);05230(Central carbon metabolism in cancer);05230(Central carbon metabolism in cancer),K12077,"528655,5170",ENSBTAT00000084040;ENSBTAT00000038518,EC:2.7.11.2,protein_coding,11.76,11.73,11.27,11.99,11.89,4.02,3.35,3.24,4.33,3.18
Glucose metabolism,ENSBTAG00000031503,"ETC, OXPHOS",NDUFA4L2,"NDUFA4, mitochondrial complex associated like 2 ",12.52,3.65,0.00,0.00,up,yes,GO:0004129(cytochrome-c oxidase activity);GO:0005751(mitochondrial respiratory chain complex IV);GO:0022900(electron transport chain);GO:1902600(proton transmembrane transport),00190(Oxidative phosphorylation);04714(Thermogenesis);04723(Retrograde endocannabinoid signaling);04932(Non-alcoholic fatty liver disease (NAFLD));05010(Alzheimer disease);05012(Parkinson disease);05016(Huntington disease),K03948,613541,ENSBTAT00000038247,NA,protein_coding,5.15,5.48,5.71,5.91,6.57,0.88,0.55,0.19,0.36,0.33
Glucose metabolism,ENSBTAG00000014831,glycogen biosynthesis,PPP1R3C,protein phosphatase 1 regulatory subunit 3C ,6.66,2.74,0.00,0.00,up,yes,GO:0005515(protein binding);GO:0005975(carbohydrate metabolic process);GO:0005977(glycogen metabolic process);GO:0005978(glycogen biosynthetic process);GO:0019888(protein phosphatase regulator activity);GO:0019903(protein phosphatase binding);GO:0043666(regulation of phosphoprotein phosphatase activity),04910(Insulin signaling pathway);04931(Insulin resistance),K07189,539466,ENSBTAT00000019753,NA,protein_coding,4.13,3.59,4.05,4.40,4.45,0.48,0.69,0.67,0.42,0.84
Glucose metabolism,ENSBTAG00000054777,glycogen biosynthesis,PPP1R3G,protein phosphatase 1 regulatory subunit 3G ,1935.74,10.92,0.00,0.00,up,yes,GO:0005515(protein binding),NA,NA,616147,ENSBTAT00000084835,NA,protein_coding,0.11,0.36,0.12,0.25,0.13,0,0,0,0,0
Glucose metabolism,ENSBTAG00000031814,"gluconeogenesis, provide pyruvate for gluconeogenesis to form glucose from serine.",SDS,serine dehydratase ,17.64,4.14,0.00,0.01,up,yes,GO:0003941(L-serine ammonia-lyase activity);GO:0004794(L-threonine ammonia-lyase activity);GO:0005739(mitochondrion);GO:0005829(cytosol);GO:0006520(cellular amino acid metabolic process);GO:0006565(L-serine catabolic process);GO:0006567(threonine catabolic process);GO:0030170(pyridoxal phosphate binding);GO:0042803(protein homodimerization activity);GO:0042866(pyruvate biosynthetic process),"00260(Glycine, serine and threonine metabolism);00270(Cysteine and methionine metabolism);00290(Valine, leucine and isoleucine biosynthesis)",K17989,"514346,51119",ENSBTAT00000081738,4.3.1.19;EC:4.3.1.17,protein_coding,0.45,0.53,0.20,0.32,0.47,0.07,0,0.04,0,0
,,,,,,,,,,,,,,,,,,,,,,,,,,,
,,,,,,,,,,,,,,,,,,,,,,,,,,,
